<?xml version="1.0" encoding="UTF-8"?>

 <!DOCTYPE catalog SYSTEM "dams.dtd" [
  <!ENTITY dam-img1 PUBLIC "IMAGE" "https://vila.bg/blog/wp-content/uploads/2021/03/batak-1-1337.jpg" NDATA JPG>
  <!ENTITY dam-img2 PUBLIC "IMAGE" "https://rezervaciq.com/img/objects/sights_999_1009251696r_1315749705_Belmeken.jpg" NDATA JPG>
  <!ENTITY dam-img3 PUBLIC "IMAGE" "https://lovevelingrad.com/wp-content/uploads/2023/05/%D0%B4%D0%BE%D1%81%D0%BF%D0%B0%D1%82.jpg" NDATA JPG>
  <!ENTITY dam-img4 PUBLIC "IMAGE" "https://vodoemibg.site.netvision.bg/wp-content/uploads/2021/10/5-12.jpg" NDATA JPG>
  <!ENTITY dam-img5 PUBLIC "IMAGE" "https://vila.bg/blog/wp-content/uploads/2021/03/zhrebchevo-1341.jpg" NDATA JPG>
  <!ENTITY dam-img6 PUBLIC "IMAGE" "https://static.pochivka.bg/sights.bgstay.com/images/01/1064/547f683644890.jpg" NDATA JPG>
  <!ENTITY dam-img7 PUBLIC "IMAGE" "https://static.pochivka.bg/sights.bgstay.com/images/01/1433/5465410fee1bf.jpg" NDATA JPG>
  <!ENTITY dam-img8 PUBLIC "IMAGE" "https://www.bg-guide.org/thumbs/1130x636/objects/studen-kladenets/studen-kladenets-karzdhali_1130x636_crop_4dae7d5955.jpg" NDATA JPG>
  <!ENTITY dam-img9 PUBLIC "IMAGE" "https://i.ytimg.com/vi/fK_IF5IAnQg/maxresdefault.jpg" NDATA JPG>
  <!ENTITY dam-img10 PUBLIC "IMAGE" "https://img.vila.bg/a/252/848.jpg" NDATA JPG>
]
>

<catalog>

    <river id="r_iskar">
        <name>р. Искър</name>
        <length>368 km</length>
    </river>
    <river id="r_topolnica">
        <name>р. Тополница</name>
        <length>154 km</length>
    </river>
    <river id="r_ardan">
        <name>р. Арда</name>
        <length>272 km</length>
    </river>
    <river id="r_mesta">
        <name>р. Места</name>
        <length>273 km</length>
    </river>

    <region id="reg_southwest">
        <name>Югозападен регион</name>
        <description>
            Включва част от Рила, Пирин и Родопите. Характеризира се с планински релеф, 
            богати водни ресурси и няколко големи язовира. Често се посещава от любителите
            на зимни спортове и планински преходи.
        </description>
        <sightseeing>
            Популярни забележителности: курорт Боровец, Рилския манастир, 
            множество еко пътеки в Родопите.
        </sightseeing>

        <dam id="dam_iskar" riverRef="r_iskar">
            <name>Язовир Искър</name>
            <location>На р. Искър, близо до София</location>
            <capacity>673 млн. m3</capacity>
            <usage>Питейно водоснабдяване, електропроизводство. Служи и за отдих и развлечение, особено през летния сезон. Някои части са достъпни за риболов.</usage>
            <coordinates>42.5010, 23.5643</coordinates>
            <photo>
				<src url="dam-img1"/>
			</photo>
            <characteristics>
                Най-големият язовир в България по обем. Използва се за водоснабдяване на София 
                и производство на електроенергия. Разположен е сред живописни хълмове и често привлича водни спортове 
                като ветроходство и каяк. 
            </characteristics>
            <note>
                Известен с ветроходните регати и възможност за различни водни спортове. 
                В някои зони около язовира се провеждат и национални състезания по риболов.
            </note>
        </dam>

        <dam id="dam_belme">
            <name>Язовир Белмекен</name>
            <location>В Рила, общ. Белово</location>
            <capacity>140 млн. m3</capacity>
            <usage>Енергийно, част от каскада Белмекен-Сестримо. Високопланинските условия допринасят за значителна енергийна ефективност, а околността е подходяща за туризъм.</usage>
            <coordinates>42.0927, 23.8611</coordinates>
            <photo>
				<src url="dam-img5"/>
			</photo>
            <characteristics>
                Високопланински язовир, част от каскадата Белмекен-Сестримо. 
                Използва се за производство на електроенергия. Разположен е на над 1900 м надморска височина,
                което позволява съхранение на вода в зимни условия и пиково електропроизводство.
            </characteristics>
            <note>
                Отлично място за тренировки на висока надморска височина (има спортна база наблизо).
                Много от националните отбори по различни спортове провеждат лагери тук, заради чистия въздух и планинския климат.
            </note>
        </dam>
    </region>

    <region id="reg_southcentral">
        <name>Южноцентрален регион</name>
        <description>
            Обхваща Родопите и Горнотракийската низина. Разполага с множество язовири 
            по р. Арда и нейните притоци. Климатът е преходно-средиземноморски, с меки зими
            и горещи лета.
        </description>
        <sightseeing>
            Забележителности: Дяволският мост край Ардино, Ягодинската пещера, 
            Перперикон, природни феномени в Родопите.
        </sightseeing>

        <dam id="dam_kardjali" riverRef="r_ardan">
            <name>Язовир Кърджали</name>
            <location>На р. Арда, обл. Кърджали</location>
            <capacity>539 млн. m3</capacity>
            <usage>Напояване, енергетика, риболов. Предоставя вода за поливни системи в региона и генерира електричество чрез ВЕЦ.</usage>
            <coordinates>41.6483, 25.3839</coordinates>
            <photo>
				<src url="dam-img2"/>
			</photo>
            <characteristics>
                Част от каскадата "Арда". Използва се за водоснабдяване, напояване и електропроизводство.
                Язовирната стена е висока 103.5 м и създава едно от най-красивите водоеми в Родопите.
                Районът около язовира е подходящ за еко-туризъм.
            </characteristics>
        </dam>

        <dam id="dam_studen" riverRef="r_ardan">
            <name>Язовир Студен кладенец</name>
            <location>На р. Арда, обл. Кърджали</location>
            <capacity>387 млн. m3</capacity>
            <usage>Риболов, електропроизводство. Някои части от бреговете са обособени като защитени зони за редки птици.</usage>
            <coordinates>41.6667, 25.5167</coordinates>
            <photo>
				<src url="dam-img8"/>
			</photo>
            <characteristics>
                Популярно място за риболов. Част от същата каскада "Арда".
                Подходящ за водни спортове и разходки с лодка. 
                Наблизо има и археологически обекти.
            </characteristics>
        </dam>

        <dam id="dam_dospat" riverRef="r_mesta">
            <name>Язовир Доспат</name>
            <location>В западните Родопи, общ. Доспат</location>
            <capacity>449 млн. m3</capacity>
            <usage>Риболов, туризъм, електропроизводство. Язовирът снабдява множество рибарници и е любима дестинация за почивка на палатка.</usage>
            <coordinates>41.6773, 24.1574</coordinates>
            <photo>
				<src url="dam-img4"/>
			</photo>
            <characteristics>
                Един от най-високите язовири в България. Основно се използва за риболов, 
                туризъм и електропроизводство. Водите му са чисти, а околността е изпълнена
                с борови гори и живописни склонове.
            </characteristics>
            <note>
                В района има множество вили и къщи за гости, подходящи за отдих и планински преходи.
                Всяка година тук се провежда фестивал на традиционната родопска кухня и музика.
            </note>
        </dam>
    </region>

    <region id="reg_southeast">
        <name>Югоизточен регион</name>
        <description>
            Обхваща части от Стара планина и източните Родопи. 
            Популярен с язовири, подходящи за туризъм и риболов. 
            Климатът е топъл и преобладава слънчево време през по-голямата част от годината.
        </description>
        <sightseeing>
            Районът предлага красотата на източните Родопи, множество запазени 
            традиционни села, както и морски достъп (област Варна).
        </sightseeing>

        <dam id="dam_tsonevo">
            <name>Язовир Цонево</name>
            <location>На р. Луда Камчия, обл. Варна</location>
            <capacity>330 млн. m3</capacity>
            <usage>Риболов, напояване. Предлага красиви гледки и е популярен за каране на кану и лодки.</usage>
            <coordinates>43.0392, 27.3337</coordinates>
            <photo>
				<src url="dam-img6"/>
			</photo>
            <characteristics>
                Трети по големина язовир в България. Известен с живописните скали в района (Чудните скали),
                където могат да се организират алпийски активности.
            </characteristics>
        </dam>
    </region>

    <region id="reg_southwest_2">
        <name>Югозападен регион (част 2)</name>
        <description>
            Допълнителна част от Югозападна България, с малки, но живописни язовири.
            Включва поречието на Тополница и други по-малки реки. 
        </description>
        
        <dam id="dam_topolnica" riverRef="r_topolnica">
            <name>Язовир Тополница</name>
            <location>На р. Тополница, общ. Пазарджик</location>
            <capacity>137 млн. m3</capacity>
            <usage>Напояване, промишлено водоснабдяване. Също е възможен ограничен риболов, особено около стената.</usage>
            <coordinates>42.3883, 24.1097</coordinates>
            <photo>
				<src url="dam-img3"/>
			</photo>
            <characteristics>
                Използва се за напояване и промишлено водоснабдяване. Стената е изградена преди повече от 50 години
                и е пример за инженерното майсторство в региона. 
            </characteristics>
        </dam>
    </region>

    <region id="reg_southcentral_2">
        <name>Южноцентрален регион (част 2)</name>
        <description>
            Разположен е в Горнотракийската низина с редица язовири, предназначени за напояване.
            Плодородните земи в района използват тези водоизточници за отглеждане на зеленчуци и 
            други земеделски култури.